
/dev/sda:

ATA device, with non-removable media
	Model Number:       ST2000NM012A-2MP130                     
	Serial Number:      WJC07G29
	Firmware Revision:  CAJC
	Transport:          Serial, ATA8-AST, SATA 1.0a, SATA II Extensions, SATA Rev 2.5, SATA Rev 2.6, SATA Rev 3.0
Standards:
	Used: unknown (minor revision code 0xffff) 
	Supported: 11 10 9 8 7 6 5 
	Likely used: 11
Configuration:
	Logical		max	current
	cylinders	16383	16383
	heads		16	16
	sectors/track	63	63
	--
	CHS current addressable sectors:    16514064
	LBA    user addressable sectors:   268435455
	LBA48  user addressable sectors:  3907029168
	Logical  Sector size:                   512 bytes
	Physical Sector size:                   512 bytes
	Logical Sector-0 offset:                  0 bytes
	device size with M = 1024*1024:     1907729 MBytes
	device size with M = 1000*1000:     2000398 MBytes (2000 GB)
	cache/buffer size  = unknown
	Form Factor: 3.5 inch
	Nominal Media Rotation Rate: 7200
Capabilities:
	LBA, IORDY(can be disabled)
	Queue depth: 32
	Standby timer values: spec'd by Standard, no device specific minimum
	R/W multiple sector transfer: Max = 1	Current = 1
	Recommended acoustic management value: 254, current value: 0
	DMA: mdma0 mdma1 mdma2 udma0 udma1 udma2 udma3 udma4 udma5 *udma6 
	     Cycle time: min=120ns recommended=120ns
	PIO: pio0 pio1 pio2 pio3 pio4 
	     Cycle time: no flow control=120ns  IORDY flow control=120ns
Commands/features:
	Enabled	Supported:
	   *	SMART feature set
	    	Security Mode feature set
	   *	Power Management feature set
	   *	Write cache
	   *	Look-ahead
	   *	WRITE_BUFFER command
	   *	READ_BUFFER command
	   *	DOWNLOAD_MICROCODE
	    	Power-Up In Standby feature set
	   *	SET_FEATURES required to spinup after power up
	    	SET_MAX security extension
	   *	48-bit Address feature set
	   *	Mandatory FLUSH_CACHE
	   *	FLUSH_CACHE_EXT
	   *	SMART error logging
	   *	SMART self-test
	   *	Media Card Pass-Through
	   *	General Purpose Logging feature set
	   *	WRITE_{DMA|MULTIPLE}_FUA_EXT
	   *	64-bit World wide name
	   *	IDLE_IMMEDIATE with UNLOAD
	    	Write-Read-Verify feature set
	   *	WRITE_UNCORRECTABLE_EXT command
	   *	{READ,WRITE}_DMA_EXT_GPL commands
	   *	Segmented DOWNLOAD_MICROCODE
	   *	unknown 119[6]
	   *	unknown 119[7]
	    	unknown 119[8]
	    	unknown 119[9]
	   *	Gen1 signaling speed (1.5Gb/s)
	   *	Gen2 signaling speed (3.0Gb/s)
	   *	Gen3 signaling speed (6.0Gb/s)
	   *	Native Command Queueing (NCQ)
	   *	Phy event counters
	   *	Idle-Unload when NCQ is active
	   *	READ_LOG_DMA_EXT equivalent to READ_LOG_EXT
	   *	DMA Setup Auto-Activate optimization
	   *	Software settings preservation
	    	unknown 78[7]
	    	unknown 78[11]
	   *	SMART Command Transport (SCT) feature set
	   *	SCT Write Same (AC2)
	   *	SCT Error Recovery Control (AC3)
	   *	SCT Features Control (AC4)
	   *	SCT Data Tables (AC5)
	    	unknown 206[7]
	    	unknown 206[12] (vendor specific)
	    	unknown 206[14] (vendor specific)
	   *	SANITIZE_ANTIFREEZE_LOCK_EXT command
	   *	SANITIZE feature set
	   *	CRYPTO_SCRAMBLE_EXT command
	   *	OVERWRITE_EXT command
	   *	reserved 69[3]
	   *	reserved 69[4]
Security: 
	Master password revision code = 65534
		supported
	not	enabled
	not	locked
		frozen
	not	expired: security count
		supported: enhanced erase
	208min for SECURITY ERASE UNIT. 2min for ENHANCED SECURITY ERASE UNIT.
Logical Unit WWN Device Identifier: 5000c500cf543289
	NAA		: 5
	IEEE OUI	: 000c50
	Unique ID	: 0cf543289
Checksum: correct
